{
  "tenant_id": "11111111-1111-4111-8111-111111111111",
  "runtime_tenant_id": "66666666-6666-4666-8666-666666666666",
  "operation_id": "22222222-2222-4222-8222-222222222222",
  "hostname": "sample.one.example.test",
  "initiator_id": "44444444-4444-4444-8444-444444444444",
  "source": "user",
  "authorization_basis": "owner"
}
